{
  "id": "memory-cards",
  "title": {
    "en": "Animal Memory Cards",
    "ja": "どうぶつカードめくり"
  },
  "icon": "/apps/memory-cards/icon.svg",
  "category": "memory",
  "description": {
    "en": "Flip the cards and find the matching animals!",
    "ja": "カードをめくっておなじ動物を見つけよう！"
  },
  "entry": "/apps/memory-cards/",
  "languages": [
    "en",
    "ja"
  ],
  "minAge": 3
}
